### ISSUE TITLE
Server Client connection not possible after 4f526f50483b2a38a95697e28662761cc8ded342

### ISSUE THREAD

**Issue by pdelinik** [dl1ycf/pihpsdr#98]
Since commit 4f526f50483b2a38a95697e28662761cc8ded342  server -client stopped working. Both udp and tcp rules are active for the server port used. Server starts normally - client remains in splashscreen saying Discovery completed after hitting connect button - No error message whatsoever.

Thanks,
Panos

**Comment by dl1ycf** [comment]
This is an old commit and I have worked client/server much since that time. Since the client/server version has changed,
but sure to re-compile both on the client and server side.

What was really new in this commit is to send the periodic data via UDP.

You are certain there is no error message in the log file? If the UDP connection blocks, the radio should start but you get
not panadapter updates.  If "nothing happens" and no error message occurs it can only hang on the TCP listener, and if
that happens and the connection is OK, the server has obviously given up, so the log files of both the server and the client
need be inspected.

**Comment by pdelinik** [comment]
Thank you for the extensive description. Still no joy in my case. Both UDP and TCP streams are on the same port defined in the server menu?

**Comment by pdelinik** [comment]
Client log 

sudo tcpdump -i eth0 port 50000
tcpdump: verbose output suppressed, use -v[v]... for full protocol decode
listening on eth0, link-type EN10MB (Ethernet), snapshot length 262144 bytes
11:38:55.612543 IP raspberrypi.37510 > SERVER :50000: Flags [S], seq 3995937975, win 64240, options [mss 1460,sackOK,TS val 707303589 ecr 0,nop,wscale 7], length 0
11:38:55.640394 IP SERVER :50000 > raspberrypi.37510: Flags [S.], seq 1936064701, ack 3995937976, win 65160, options [mss 1452,sackOK,TS val 3923769891 ecr 707303589,nop,wscale 7], length 0
11:38:55.640408 IP raspberrypi.37510 > SERVER :50000: Flags [.], ack 1, win 502, options [nop,nop,TS val 707303616 ecr 3923769891], length 0
11:38:55.667749 IP SERVER :50000 > raspberrypi.37510: Flags [P.], seq 1:5, ack 1, win 510, options [nop,nop,TS val 3923769918 ecr 707303616], length 4
11:38:55.667761 IP raspberrypi.37510 > SERVER :50000: Flags [.], ack 5, win 502, options [nop,nop,TS val 707303644 ecr 3923769918], length 0
11:38:55.696254 IP SERVER :50000 > raspberrypi.37510: Flags [P.], seq 5:69, ack 1, win 510, options [nop,nop,TS val 3923769947 ecr 707303644], length 64
11:38:55.696265 IP raspberrypi.37510 > SERVER :50000: Flags [.], ack 69, win 502, options [nop,nop,TS val 707303672 ecr 3923769947], length 0
11:38:55.799137 IP raspberrypi.37510 > SERVER :50000: Flags [P.], seq 1:65, ack 69, win 502, options [nop,nop,TS val 707303775 ecr 3923769947], length 64
11:38:55.860247 IP SERVER :50000 > raspberrypi.37510: Flags [.], ack 65, win 510, options [nop,nop,TS val 3923770077 ecr 707303775], length 0
11:38:55.860258 IP SERVER :50000 > raspberrypi.37510: Flags [P.], seq 69:70, ack 65, win 510, options [nop,nop,TS val 3923770077 ecr 707303775], length 1
11:38:55.860269 IP raspberrypi.37510 > SERVER :50000: Flags [.], ack 70, win 502, options [nop,nop,TS val 707303836 ecr 3923770077], length 0
11:38:59.065104 IP SERVER :50000 > raspberrypi.37510: Flags [F.], seq 70, ack 65, win 510, options [nop,nop,TS val 3923773316 ecr 707303836], length 0
11:38:59.108433 IP raspberrypi.37510 > SERVER :50000: Flags [.], ack 71, win 502, options [nop,nop,TS val 707307085 ecr 3923773316], length 0
^C
13 packets captured
13 packets received by filter
0 packets dropped by kernel


Does the client even try to send that initial udp package to the server?

**Comment by dl1ycf** [comment]
This I do not understand at all. First, it says it goes to eht0 and should have been
detected by the previous „tcpdump“, and then, it goes to server IP with port 50000
and this „fits“ to the client log sent previously. Note you declare the port

- on the server side: in the server menu
- on the client side: in the address field after the colon

and these must coincide (and do it, in your case).

Since all your logs either show port „00000“ and „50000“: it this all hand edited? The
port numbers are in principle not sensitive information, so I am left in the dark
whether there is a mismatch or not.
